{
  "schema_version": "ctoa.heal-friend-observation.v1",
  "observation_id": "fixture-exact-friend",
  "observed_at_unix_ms": 1783799999000,
  "party_observed_at_unix_ms": 1783799999000,
  "producer_source": "fixture",
  "online": "online",
  "alive": "alive",
  "protection_zone": "outside",
  "protection_zone_source": "player_method",
  "self_id": 111111,
  "target_id": 424242,
  "observed_target_id": 424242,
  "current_target_id": 424242,
  "target_name": "fixture ally",
  "observed_target_name": "fixture ally",
  "current_target_name": "fixture ally",
  "whitelist_revision": "15648e2d2f6695035e40307c6b453d08df688847b5ae0f742cb2b7a5ee9d43b3",
  "party_member_ids": [424242],
  "target_is_player": true,
  "target_is_self": false,
  "target_visible": true,
  "target_same_floor": true,
  "distance": 3,
  "observed_target_hp_percent": 42,
  "current_target_hp_percent": 42,
  "cooldown": "ready",
  "cooldown_source": "game_cooldown_group",
  "dispatch_allowed": false,
  "runtime_actions": false,
  "executes_plan": false,
  "execute_once_allowed": false,
  "promotion_allowed": false,
  "casts": false,
  "talks": false,
  "intrusive_actions_performed": []
}
